{
  "entry_id": "01JGITHUBTEST123456789ABCD",
  "issued_at": "2026-02-01T15:00:00.000Z",
  "subject_type": "code",
  "subject_ref": "github-test",
  "subject_locator": "https://github.com/stoneplatforms/test",
  "policy_version": "sv-0.1",
  "result": "pass",
  "scores": {
    "security": 10,
    "repro": 9
  },
  "report_hash": "sha256:3333333333333333333333333333333333333333333333333333333333333333",
  "key_id": "stone-verified-ed25519-2026-01",
  "signature": "e/A2bIlORIFncLW9UlxXqUCgQ9AFG3xaHgj5dKjMT2FBhak7Mn03ONirE/b8ZEG+35/2eXZqto8Uvs4fkWqeAw=="
}
