{
  "entry_id": "01KGE69TF4K11XABNKQ7DDTBMB",
  "issued_at": "2026-02-02T03:28:21.476Z",
  "subject_type": "document",
  "subject_ref": "example-business-001",
  "business_legal_name": "Example Corp Inc.",
  "business_ein": "12-3456789",
  "business_country": "United States",
  "app_name": "ExampleApp",
  "app_version": "1.2.3",
  "app_platform": "web",
  "compliance_standards": [
    "GDPR",
    "SOC2"
  ],
  "tags": [
    "fintech",
    "verified"
  ],
  "ai_models_used": [
    "claude-3",
    "gpt-4"
  ],
  "policy_version": "sv-0.1",
  "result": "pass",
  "report_hash": "sha256:64c5f732add2b2cd37bc948b275f4fd175059ee9f2fc1640ebbf642e07b24166",
  "key_id": "stone-verified-ed25519-2026-01",
  "signature": "aDFWLzHHRj6lL2AjjhLA1tsh4B7NSKAzGDAnKmQQVlKIyGK34lC8Hakqwu3ifMNHYTgJBLj5b2M6zzD8HxpCAQ=="
}
